{
    "blockers": [
        "G13_MANDATORY_G12_REPLAY_OPEN remains binding and blocks G15 and G17: the frozen G13 adapter/campaign has no executable G12 workload path, so a new versioned G12-specific G13-compatible adapter/campaign and Linux/GCC replay are required."
    ],
    "final_summary": "G14 completed with an engineering and preservation PASS: the versioned content-addressed proof store, portable bundle, hostile campaign, independent verifier, frozen handoff, manifest, and state transition all passed. The inherited mandatory G12-through-G13 acceptance replay remains NOT_PERFORMED, so G15 is not authorized and was not started.",
    "freeze_manifest_path": "research/G14/G14_Freeze_Manifest.json",
    "gate_result": "PASS",
    "handoff_path": "research/G14/G14_Technical_Handoff.md",
    "human_input_reason": null,
    "human_input_required": false,
    "next_programme": "G15",
    "next_programme_authorized": false,
    "program_state_path": "state/PROGRAM_STATE.json",
    "programme": "G14",
    "run_id": "G14-a01-d02c7f5da9fe",
    "schema_version": "1.0.0",
    "state_transition": {
        "from": "G13",
        "to": "G14"
    },
    "status": "PASS",
    "tests_run": [
        {
            "command": "python -B research/G14/g14_reference_campaign.py --output-dir research/G14 --work-parent .run/g14-campaign-work --verifier research/G14/g14_independent_verifier.py",
            "exit_code": 0,
            "result": "PASS",
            "summary": "All 14 frozen positive checks passed, all 30 hostile mutations were rejected, and the campaign stayed within its prospectively frozen offline 300-second limit."
        },
        {
            "command": "repeat the full campaign from empty stores and compare the bundle plus three ledger hashes",
            "exit_code": 0,
            "result": "PASS",
            "summary": "A complete empty-store rerun reproduced the bundle and campaign, hostile, and independent-verification ledger bytes exactly."
        },
        {
            "command": "python -B research/G14/test_g14_proof_store.py",
            "exit_code": 0,
            "result": "PASS",
            "summary": "All 17 proof-store regression and adversarial tests passed."
        },
        {
            "command": "python -B research/G14/g14_independent_verifier.py research/G14/G14_Portable_Proof_Store_Bundle.zip --ledger .run/G14_Independent_Replay.json --expected-contract-sha256 d0d36fd32cdc7470642c4f91a4f894891cad9e5c4291fb5348fa2be0da729825",
            "exit_code": 0,
            "result": "PASS",
            "summary": "The structurally separate verifier passed 10 of 10 checks over 75 objects and reproduced the frozen ledger hash exactly in a fresh process."
        },
        {
            "command": "python -B research/G14/g14_g13_replay_pregate.py --out research/G14/G14_G13_G12_PreGate_Ledger.json",
            "exit_code": 0,
            "result": "PASS",
            "summary": "Recovered G12 and G13 archive identities and internal ledgers verified exactly; the mandatory distributed G12-through-G13 replay remains explicitly NOT_PERFORMED because the frozen executable path does not exist."
        },
        {
            "command": "python -B research/G14/g14_proof_store.py inspect-bundle research/G14/G14_Portable_Proof_Store_Bundle.zip",
            "exit_code": 0,
            "result": "PASS",
            "summary": "The canonical portable bundle resolved two roots across 75 objects and passed offline inspection."
        },
        {
            "command": "python scripts/validation/validate_g_completion.py --repo . --programme G14 --run-id G14-a01-d02c7f5da9fe --base-commit ce50d28f552b91b0441e6eea701d87ac6501d512 --before-state .run/g14-before-state.json --completion .run/g14-completion-candidate.json",
            "exit_code": 0,
            "result": "PASS",
            "summary": "The independent closeout validator classified the transaction as scientific and returned valid=true with no errors."
        }
    ],
    "validation_summary": {
        "checks": [
            "Freeze-manifest and PROGRAM_STATE Draft 2020-12 schemas passed.",
            "All five frozen authority inputs and all 19 manifest artifact hashes and sizes matched.",
            "All G14_SHA256SUMS entries matched exact bytes.",
            "Independent replay and deterministic reproduction requirements passed.",
            "git diff --check passed and no G15 research path was touched.",
            "Independent completion admission returned valid=true with no errors.",
            "G14 claims remain engineering/preservation only; no chess truth or initial-position reachability is claimed."
        ],
        "result": "PASS"
    }
}
